{
  "schemaVersion": 1,
  "name": "Midnight",
  "mode": "dark",
  "colors": {
    "background": "#0b1020",
    "surface": "#141a2e",
    "surfaceElevated": "#1c2440",
    "text": "#e6e9f2",
    "textMuted": "#8b93a8",
    "accent": "#7c6cff",
    "accentContrast": "#ffffff",
    "border": "#2a3352"
  }
}
